{
  "schema_version": 1,
  "kind": "world.module",
  "source": "docs/scenario/05-world-module-i-threshold.md:3",
  "world": {
    "key": "threshold",
    "name": "阈界都市",
    "engine": "tactics",
    "world_type": "modern",
    "source": "docs/scenario/05-world-module-i-threshold.md:3"
  },
  "glossary": [
    {
      "term": "阈界",
      "meaning": "现实之下的夹层，有意图，行为不可预测",
      "source": "docs/scenario/05-world-module-i-threshold.md:58"
    },
    {
      "term": "阈质",
      "meaning": "渗过来的物质／性质",
      "source": "docs/scenario/05-world-module-i-threshold.md:59"
    },
    {
      "term": "渗溢",
      "meaning": "阈界向这边的一次明显渗透",
      "source": "docs/scenario/05-world-module-i-threshold.md:60"
    },
    {
      "term": "共鸣者",
      "meaning": "约 3% 的人，能感知并运用阈质",
      "source": "docs/scenario/05-world-module-i-threshold.md:61"
    },
    {
      "term": "阈丝度",
      "meaning": "个体累积的阈质污染程度（见第 5 节）",
      "source": "docs/scenario/05-world-module-i-threshold.md:62"
    },
    {
      "term": "回声",
      "meaning": "某个地方残留的过去事件的\"重放\"",
      "source": "docs/scenario/05-world-module-i-threshold.md:63"
    },
    {
      "term": "薄处",
      "meaning": "现实特别薄、容易渗溢的地点",
      "source": "docs/scenario/05-world-module-i-threshold.md:64"
    },
    {
      "term": "敷面",
      "meaning": "官方对异常现象的统称，也指掩盖事件的整套流程",
      "source": "docs/scenario/05-world-module-i-threshold.md:65"
    },
    {
      "term": "办公厅",
      "meaning": "市政特别事务办公厅，官方主管机构",
      "source": "docs/scenario/05-world-module-i-threshold.md:66"
    }
  ],
  "history": [
    {
      "id": "hist-1971",
      "year": "1971",
      "name": "第一次渗溢（\"长夏\"）",
      "detail": "江州市西区连续四十天出现无法解释的光与低频声。官方记录为\"地下电缆故障引发的光学现象\"。此后该区居民中第一批\"敏感体质\"被识别出来。",
      "source": "docs/scenario/05-world-module-i-threshold.md:74"
    },
    {
      "id": "hist-1978",
      "year": "1978",
      "name": "市政设立特别勘察组",
      "detail": "市政设立特别勘察组，即办公厅前身。编制 12 人，经费来自一笔没有名目的款项。",
      "source": "docs/scenario/05-world-module-i-threshold.md:75"
    },
    {
      "id": "hist-1984",
      "year": "1984",
      "name": "第三隧道事件",
      "detail": "地铁三号线施工队在地下挖到一段不属于任何图纸的隧道。施工人员 9 人进入，3 人返回。返回的 3 人中，2 人在两年内自杀。",
      "source": "docs/scenario/05-world-module-i-threshold.md:76"
    },
    {
      "id": "hist-1991",
      "year": "1991",
      "name": "第一台抑噪器研制成功",
      "detail": "第一台抑噪器研制成功。原理至今不明，但其核心部件来自第三隧道。",
      "source": "docs/scenario/05-world-module-i-threshold.md:77"
    },
    {
      "id": "hist-1996",
      "year": "1996",
      "name": "白鹭洲夜雨",
      "detail": "一场持续九天的雨落在白鹭洲老旧住区，事后该区约 400 名居民出现共同的记忆缺失——他们当中没有一个人能说出那年夏天发生了什么。此事件至今没有解密。",
      "source": "docs/scenario/05-world-module-i-threshold.md:78"
    },
    {
      "id": "hist-2003",
      "year": "2003",
      "name": "共鸣者地下互助网络\"雾缆\"形成",
      "detail": "共鸣者地下互助网络\"雾缆\"形成。最初只是一个通讯录。",
      "source": "docs/scenario/05-world-module-i-threshold.md:79"
    },
    {
      "id": "hist-2009",
      "year": "2009",
      "name": "财团开始收购薄处周边的地产",
      "detail": "财团开始收购薄处周边的地产。同年，第一家研究阈质商业化的公司成立。",
      "source": "docs/scenario/05-world-module-i-threshold.md:80"
    },
    {
      "id": "hist-2014",
      "year": "2014",
      "name": "Ia — \"第十二层\"事故",
      "detail": "某写字楼电梯在一次渗溢中把 11 名夜班员工送到了一个不存在的楼层。7 小时后，其中 4 人被送回，年龄比进入时平均老了 3 岁。",
      "source": "docs/scenario/05-world-module-i-threshold.md:81"
    },
    {
      "id": "hist-2019",
      "year": "2019",
      "name": "《异常现象管控条例》生效",
      "detail": "《异常现象管控条例》生效。共鸣者被要求登记。至今约 41% 已登记。",
      "source": "docs/scenario/05-world-module-i-threshold.md:82"
    },
    {
      "id": "hist-2023",
      "year": "2023",
      "name": "黑潮首次公开活动",
      "detail": "黑潮首次公开活动。同一年，江州市的薄处数量首次突破三百处。",
      "source": "docs/scenario/05-world-module-i-threshold.md:83"
    },
    {
      "id": "hist-2026",
      "year": "2026（现在）",
      "name": "渗溢频率达到每月 4–7 次",
      "detail": "渗溢频率达到每月 4–7 次，是十年前的六倍。办公厅编制扩充至 800 人但仍捉襟见肘。有人说，这座城已经在漏了。",
      "source": "docs/scenario/05-world-module-i-threshold.md:84"
    }
  ],
  "regions": [
    {
      "id": "region-01",
      "name": "环港区（旧港）",
      "summary": "老港口改建区，保留了 1–7 号库区。三号码头被封了二十年。薄处密度全市第一，因为这里的地基下有东西。",
      "atmosphere": "集装箱、锈、海腥味、夜班的吆喝、永远在修的路。",
      "key_places": [
        "7 号冷藏库区（常年出租给不在工商登记上的公司）",
        "码头的旧钟楼（钟停在 3:47）",
        "渔民自发的最高 —— 自发的小市场"
      ],
      "powers": [
        "搬运工会（实质上的地头蛇）",
        "三家试图收购码头地产的财团",
        "黑潮的一个据点"
      ],
      "events": [
        "偷渡",
        "走私",
        "失踪的集装箱",
        "\"某些声音从货柜里传出来\""
      ],
      "source": "docs/scenario/05-world-module-i-threshold.md:94"
    },
    {
      "id": "region-02",
      "name": "中央高线",
      "summary": "金融与总部区。这里是薄处密度最低的地方——不是因为安全，而是因为这里的每一栋楼都装有抑噪器，且有人在维护。",
      "atmosphere": "玻璃、水景、地下停车场的气味、说话很小声的人。",
      "key_places": [
        "环宇中心（52 层，第 44 层的档案看不了）",
        "明湖酒店大堂（一个绝佳的观察点）",
        "地下三层停车场（每个司机都说那里不对劲）"
      ],
      "powers": [
        "四家财团",
        "办公厅总部（在 31 层，对外挂牌是\"城市发展研究院\"）"
      ],
      "events": [
        "商业间谍",
        "被压下的内部报告",
        "有人愿意花大钱让某份消失"
      ],
      "source": "docs/scenario/05-world-module-i-threshold.md:104"
    },
    {
      "id": "region-03",
      "name": "白鹭洲",
      "summary": "1960 年代建成的居住区，居民多为老人与外来务工者。房租便宜。1996 年夜雨的发生地。",
      "atmosphere": "老梧桐、六层住宅楼、麻将声、常年晾在外面的衣服。",
      "key_places": [
        "白鹭洲第三小学（夜间有读书声，而学校已停办十年）",
        "洲心菜市场（凌晨四点的交易不全是菜）",
        "7 号楼（整栋楼只剩 3 户常住）"
      ],
      "powers": [
        "居委会（比警察更有实权）",
        "一个守护秘密的老住户团体"
      ],
      "events": [
        "老人讲述的互相矛盾的版本",
        "某个出租屋里的临时祭坛",
        "每月一次的“停电”"
      ],
      "source": "docs/scenario/05-world-module-i-threshold.md:114"
    },
    {
      "id": "region-04",
      "name": "铁北工业区",
      "summary": "苏联式规划的重工业区，1990 年代后逐渐衰败，但仍有几家在运转。这里的人类苦难浓度最高，因此异常也带有强烈的\"无奈\"气质。",
      "atmosphere": "废弃但没完全废弃的厂房、巨大的风扇、蒸汽、中午十二点的汽笛。",
      "key_places": [
        "第三冶炼厂（已封，成为都市传说地标）",
        "冷却塔群（内部有内壁涂鸦史，记录了三十年）",
        "铁北职工医院（精神科在三楼，常年满床）"
      ],
      "powers": [
        "留守的产业工人",
        "一个拒绝搬走的家族式小帮派"
      ],
      "events": [
        "工伤被掩盖",
        "有人在厂房里长期独自生活",
        "设备自己在运转"
      ],
      "source": "docs/scenario/05-world-module-i-threshold.md:124"
    },
    {
      "id": "region-05",
      "name": "大学城 · 松岭",
      "summary": "七所高校集中区。这里的特点是年轻人很多，因此理论与莽撞都很多。第一份抑噪器的原始论文出自这里。",
      "atmosphere": "廉价的食物、凌晨的灯光、永远有人在争论的地方。",
      "key_places": [
        "松岭大学地下物理实验室（经费来源不明）",
        "学生活动中心三楼（一个自发的研究小组在此聚会）",
        "旧图书馆的四层书库（很多书的内容与书名不符）"
      ],
      "powers": [
        "未登记的共鸣者学生网络",
        "校方的\"纪律\"机构",
        "一个名为\"限度\"的兴趣社团"
      ],
      "events": [
        "学生失踪（被当作退学处理）",
        "未经许可的实验",
        "某个教授的奇怪作息"
      ],
      "source": "docs/scenario/05-world-module-i-threshold.md:134"
    },
    {
      "id": "region-06",
      "name": "碗底（下沉市场）",
      "summary": "位于旧河道改造成的下沉广场内的黑市。三层，向下延伸。城中最大的非官方信息交易中心。",
      "atmosphere": "塑料棚、临时灯串、什么都能买到，包括不该买到的东西。",
      "key_places": [
        "负一层\"字湾区\"（假证与真档案混着卖）",
        "负二层器械区",
        "负三层（没人承认它存在）"
      ],
      "powers": [
        "鸢尾（Iris）这样的独立情报贩子",
        "三个共享地盘的小帮派"
      ],
      "events": [
        "买到不该有的东西",
        "被跟踪",
        "某个摊位换了主人"
      ],
      "source": "docs/scenario/05-world-module-i-threshold.md:144"
    },
    {
      "id": "region-07",
      "name": "新城 · 镜湖区",
      "summary": "2005 年后新建的高档居住区。这里的法则与前六个区不同：这里的人们有钱让别人替他们处理异常。",
      "atmosphere": "干净的街道、玻璃幕墙、没人认识邻居、保安比警察多。",
      "key_places": [
        "镜湖会馆（会员制，会员名单是本市最有价值的文件之一）",
        "17 号楼（整栋为一个公司所有）",
        "湖底隧道（每晚十一点后关闭，官方理由是维护）"
      ],
      "powers": [
        "业主委员会（实际的控制者）",
        "几家安保公司"
      ],
      "events": [
        "邻居消失但房子仍有人打扫",
        "孩子在湖边看到别人看不到的东西"
      ],
      "source": "docs/scenario/05-world-module-i-threshold.md:154"
    },
    {
      "id": "region-08",
      "name": "七号线沿线（地铁）",
      "summary": "七号线是全城唯一全线穿过五个薄处的地铁线。列车员有不成文的规矩：某些站点不停靠，但不写在任何告示里。",
      "atmosphere": "风、规律的轰鸣、凌晨最后一班车的空旷、每一次停靠都是一个故事的开始。",
      "key_places": [
        "青龙寺站（时刻表上有，实际已停用十四年）",
        "两站之间的一段隧道（长度每次测量不同）",
        "车场的夜间检修库"
      ],
      "powers": [
        "地铁运营公司的一个三人小组（他们知道很多，且不说）"
      ],
      "events": [
        "乘客下车后没有再上来",
        "末班车多停了一站",
        "\"有人在对面站台看着你\""
      ],
      "source": "docs/scenario/05-world-module-i-threshold.md:164"
    },
    {
      "id": "region-09",
      "name": "灰堤",
      "summary": "这里曾经是一整片村庄，现在只剩三分之一。 剩下的人是拆迁谈判谈不下来的那些。",
      "atmosphere": "城市边缘的一片过渡地带，一半是待拆迁的村落，一半是没人管的荒地。",
      "key_places": [
        "老陈渡口（渡船还在，没什么人需要去对岸）",
        "无人居住的“新村”（已建好但从未入住）",
        "一处野生的纪念地（三十七座无名碑）"
      ],
      "powers": [
        "钉子户联盟",
        "一个在这里做田野调查的民族学研究者"
      ],
      "events": [
        "回来的人不再是原来那个人",
        "地面上出现不属于任何地图的新路"
      ],
      "source": "docs/scenario/05-world-module-i-threshold.md:174"
    }
  ],
  "factions": [
    {
      "id": "office-special-affairs",
      "name": "市政特别事务办公厅",
      "alignment": "官方",
      "summary": "主管异常的官方机构，对外挂牌「城市发展研究院」；约 800 人，外勤不足 90 人；目标是秩序而非真相；内部分「记录派」与「敷面派」。",
      "source": "docs/scenario/05-world-module-i-threshold.md:190"
    },
    {
      "id": "registration-office",
      "name": "登记管理处",
      "alignment": "官方",
      "summary": "负责共鸣者登记的分支机构，掌握本市最完整的共鸣者名单。",
      "source": "docs/scenario/05-world-module-i-threshold.md:203"
    },
    {
      "id": "fogcable-society",
      "name": "雾缆会",
      "alignment": "半民间",
      "summary": "共鸣者互助网络，2003 年成立，成员约 400 人（登记仅一半）；提供隐蔽医疗、庇护、信息与假身份，代价是必须提供一次服务。",
      "source": "docs/scenario/05-world-module-i-threshold.md:209"
    },
    {
      "id": "threshold-medicine",
      "name": "阈医科",
      "alignment": "半民间",
      "summary": "铁北职工医院三楼，表面是精神科分支，实则治疗阈丝度中毒并研究其病理。",
      "source": "docs/scenario/05-world-module-i-threshold.md:217"
    },
    {
      "id": "black-tide",
      "name": "黑潮",
      "alignment": "反体制",
      "summary": "激进共鸣者组织，主张「人类应主动接触阈界」；核心约 40 人；以公开制造渗溢、窃取档案、袭击设施为手段。",